Litware 18'' Adjustable Oscillating Pedestal Fan E301 Black	143408,654
Contoso Bluetooth Notebook Mouse X305 White	143496,00
SV Hand Games women M40 Yellow	143658,864
MGS Zoo Tycoon 2: Zookeeper Collection 2008 E134	144058,60
MGS Zoo Tycoon Complete Collection E110	144257,12
Adventure Works Desk Lamp E1200 Grey	144332,5731
Contoso Private Automatic Branch Exchange M65 Grey	144620,9282
Proseware Professional Quality Plain-Paper Fax and Copier X100 Green	144707,39
MGS Zoo Tycoon Complete Collection2009 E150	145437,18
SV 512MB Laptop memory E800 Yellow	145746,7407
Contoso 16GB New Generation MP5 Player M1650 blue	146106,64
Contoso Digital Cameras Lightweight Tripod E316 Pink	146274,6948
MGS MechCollection E116	146517,28
Proseware Duplex Scanner M200 Green	146534,05
MGS Combat Flight Simulator 3 E119	146674,64
MGS Classic Flight Collection2009 E164	146889,60
SV PCI Network Adapter E904 Silver	147235,8355
NT Wireless Bluetooth Stereo Headphones E302 Pink	147601,5945
MGS Bicycle Card Games2009 E166	147840,96
MGS Train Simulator 2009 E174	148131,52
Contoso 16GB Mp5 Player M1600 Black	148185,87
WWI 2GB Spy Video Recorder Pen M300 White	148275,20
Proseware Desk Jet All-in-One Printer, Scanner, Copier M350 Black	148647,98
MGS Racing Madness 2009 E169	148771,20
Contoso 4 Handset Cordless Phone System M86 Grey	149037,4692
MGS Freelancer E113	149044,28
Contoso Bluetooth Notebook Mouse X305 Silver	149269,50
SV Keyboard E90 Grey	149566,9968
MGS Flight Simulator 2004: A Century of Flight E111	149690,80
MGS MechWarrior 4: Mercenaries E117	150213,00
Contoso 4 Handset Cordless Phone System M86 White	150470,9509
Contoso Expandable 4-Handset Cordless Phone System M206 White	151570,3332
Contoso 2-Line Speakerphone M109 Black	151600,677
MGS Zoo Tycoon Dinosaur Digs2009 E162	151997,76
Contoso Digital Cameras Lightweight Tripod E316 White	152482,3352
MGS Age of Mythology 2009 E158	152648,32
NT Wireless Bluetooth Stereo Headphones E302 Yellow	152668,7225
Contoso Conversion Lens M550 Pink	152735,25
Contoso Integrated Business Phone With card L10 Black	152817,84
Contoso Private Automatic Branch Exchange M65 White	152871,992
Contoso 16GB Mp5 Player M1600 White	153469,227
A. Datum Full Frame Digital Camera X300 Green	154338,03
Contoso 16GB Mp5 Player M1600 Red	154426,748
Contoso Centrex Phone System L10 White	154454,472
MGS Flight Simulator 2009: A Century of Flight E151	154634,02
Contoso 16GB New Generation MP5 Player M1650 Pink	155233,52
Contoso Electronic Private Automatic Branch Exchange M90 White	155750,2527
SV 500GB USB 2.0 Portable External Hard Drive X405 Pink	155824,87
SV 500GB USB 2.0 Portable External Hard Drive X405 Black	156324,28
Litware 18'' Adjustable Oscillating Pedestal Fan E301 Silver	156607,0528
MGS MechCommander 2009 E173	156756,16
Contoso Electronic Private Automatic Branch Exchange M90 Grey	156882,3696
Contoso Dual USB Power Adapter - power adapter E300 White	157002,111
Contoso Dual USB Power Adapter - power adapter E300 Grey	157182,06
MGS Dungeon Siege II E105	157190,88
Contoso In front of Centrex L15 Black	158574,3336
SV Keyboard E10 Grey	159017,32
Litware 180 CFM Vertical Discharge Fan X450 Red	159192,246
The Phone Company PDA Wifi 3.5-inch M200 White	159264,00
Contoso 16GB New Generation MP5 Player M1650 Black	159773,76
MGS Gears of War 2008 M450	159946,20
MGS Dungeon Siege 2009 E163	160406,40
Contoso Rechargeable Battery Pack E310 White	160414,2804
MGS Zoo Tycoon2009 E170	160717,76
NT Wireless Bluetooth Stereo Headphones E102 Black	162036,476
MGS Combat Flight Simulator 2009 E159	162054,72
MGS Zoo Tycoon2: Marine Mania Expansion Pack 2008 E135	162251,04
MGS Age of Empires II Gold Edition2009 E172	162359,68
WWI Wireless Bluetooth Stereo Headphones M270 Silver	162551,35
WWI Wireless Bluetooth Stereo Headphones M270 Black	162576,65
Contoso 16GB New Generation MP5 Player M1650 White	162692,32
MGS Hand Games women M400 Red	162790,92
Contoso Electronic Private Automatic Branch Exchange M90 Black	162863,6739
MGS Hand Games women M400 Black	162892,0575
Litware 180 CFM Vertical Discharge Fan X450 Black	162933,253
The Phone Company Smart phones 320 x 320 M86 Pink	163368,00
WWI Wireless Bluetooth Stereo Headphones M270 White	163418,45
MGS Age of Mythology E118	163826,32
Contoso Bluetooth Notebook Mouse E70 White	164142,50
WWI 2GB Spy Video Recorder Pen M300 Silver	164309,99
NT Wireless Bluetooth Stereo Headphones M402 Red	164318,5665
MGS Age of Empires Expansion: The Rise of Rome 2009 E181	164336,32
SV Hand Games women M40 Silver	164366,136
Contoso In front of Centrex L15 Grey	164523,2676
MGS Hand Games women M400 Yellow	164625,779
Contoso 16GB Mp5 Player M1600 Blue	164797,56
Contoso In front of Centrex L15 White	165505,8285
Proseware High-Performance Business-Class Laser Fax X200 Green	165582,16
Proseware Desk Jet All-in-One Printer, Scanner, Copier M350 White	165862,08
MGS Age of Empires III: The Asian Dynasties 2009 E127	166058,72
NT Wireless Bluetooth Stereo Headphones M402 Silver	166112,3871
MGS MechWarrior4: Mercenaries2009 E157	166342,08
MGS Return of Arcade Anniversary Edition 2009 E176	166648,00
Contoso Multi-Use Terminal Cable E308 Silver	166767,9354
SV Keyboard E90 Silver	166773,1104
Contoso Optical USB Mouse M45 Black	167170,2051
MGS Age of Empires, 2009 E182	167170,24
Contoso Carrying Case E312 White	168157,866
WWI 2GB Spy Video Recorder Pen M300 Blue	168360,77
Contoso 16GB New Generation MP5 Player M1650 Silver	168362,40
SV PCI Network Adapter E903 Silver	168873,7024
Contoso 4GB Portable MP3 Player M450 White	169438,105
MGS Hand Games women M400 Silver	169584,2135
Litware 18'' Oscillating Pedestal Fan M135 Blue	170425,50
Contoso Expandable 4-Handset Cordless Phone System M206 Black	170735,8939
MGS Age of Empires II: The Conquerors Expansion 2009 E178	171828,48
Contoso Expandable 4-Handset Cordless Phone System M206 Grey	172736,2585
MGS MechWarrior 4 Mach Paks2009 E161	173458,24
SV PCI Network Adapter E905 Silver	173729,8459
Contoso Bluetooth Notebook Mouse E70 Black	174230,00
SV Keyboard E10 Black	174249,68
NT Wireless Bluetooth Stereo Headphones E102 Blue	174854,9495
Litware 14" High Velocity Floor Fan E801 Black	175185,2113
SV Hand Games women M40 Red	175325,832
SV Keyboard E10 Silver	175966,12
SV Keyboard E10 White	175970,08
Litware 14" High Velocity Floor Fan E801 Silver	175971,1866
SV Keyboard E90 Black	176276,2833
Contoso Behind Centrex X15 White	177681,9565
Litware 180 CFM Vertical Discharge Fan X450 Blue	177778,69
Litware 14" High Velocity Floor Fan E801 Pink	177849,969
NT Wireless Bluetooth Stereo Headphones E102 Silver	178000,4695
MGS Combat Flight Simulator 2009 E177	178000,96
NT Wireless Bluetooth Stereo Headphones M402 Black	178504,1478
SV Hand Games women M40 Black	178793,916
Contoso 16GB Mp5 Player M1600 Green	179808,051
Proseware Fax Phone E100 White	179940,36
MGS Age of Empires II: The Age of Kings 2009 E180	180311,36
Contoso behind Centrex X15 Black	180565,3797
NT Wireless Bluetooth Stereo Headphones M402 Purple	180586,9395
MGS Zoo Tycoon Marine Mania 2009 E160	180714,56
Litware 14" High Velocity Floor Fan E801 White	180825,1577
MGS Flight Simulator X 2008 E133	181334,87
The Phone Company Smart phones 320 x 320 M86 Grey	181339,20
MGS Flight Simulator X Acceleration Expansion Pack 2009 E128	181829,28
MGS Bicycle Board Games2009 E165	182210,88
MGS Age of Empires III: The Asian Dynasties 2008 E126	183490,86
MGS Age of Empires II: The Age of Kings E126	184886,208
NT Wireless Bluetooth Stereo Headphones E102 White	185130,6345
MGS Age of Mythology: Gold Edition 2009 E144	185445,67
NT Wireless Transmitter and Bluetooth Headphones M150 Silver	185524,1309
Contoso Rechargeable Li-Ion Battery Pack E300 White	185612,87
Contoso Carrying Case E312 Blue	185666,8476
WWI Wireless Bluetooth Stereo Headphones M270 Pink	187354,55
NT Wireless Bluetooth Stereo Headphones M402 Green	188064,1917
The Phone Company Microsoft Windows Mobile M200 Pink	188950,19
Contoso behind Centrex X15 Grey	189788,0348
Contoso Carrying Case E312 Silver	190165,246
The Phone Company Smart phones 320 x 320 M86 White	190368,00
A. Datum Consumer Digital Camera M300 Grey	190468,575
Contoso Bluetooth Notebook Mouse E70 Silver	191017,50
Proseware Fax phone E100 Black	191227,74
SV 22xDVD M600 Black	192074,037
The Phone Company Microsoft Windows Mobile M200 White	192563,81
Proseware Fax phone E100 Grey	195609,06
Contoso Macro Zoom Lens X300 White	195664,39
The Phone Company Smart phones 320 x 320 M86 Gold	195681,60
Proseware High Speed Laser M2000 Green	196115,15
Contoso Optical USB Mouse M45 Grey	196187,0844
Proseware CRT15 E10 White	196503,23
Contoso 4G MP3 Player E400 Green	196674,2155
MGS MechWarrior 4: Vengeance 2009 E175	197592,64
MGS Fable: The Lost Chapters2008 E140	198380,93
MGS Age of Empires III: The War Chiefs 2007 E132	199087,85
Contoso Rechargeable Li-Ion Battery Pack E300 Silver	199133,1654
Proseware CRT15 E10 Black	199452,54
Litware 18'' Oscillating Pedestal Fan M135 White	200536,00
Contoso Macro Zoom Lens X300 Black	201712,465
Contoso Bluetooth Notebook Mouse E70 Grey	202941,00
MGS Zoo Tycoon 2 E108	203704,48
The Phone Company Smart phones 4 GB of Memory M300 Grey	205026,15
The Phone Company PDA Phone 4.7 inches L360 Silver	207190,80
A. Datum Bridge Digital Camera M300 Silver	207333,777
NT Wireless Transmitter and Bluetooth Headphones M150 Red	207854,6421
Contoso 4GB Portable MP3 Player M450 Black	208841,8915
MGS Rise of Nations: Gold Edition 2009 E143	210461,78
Litware 17'' Oscillating Pedestal Fan M125 Blue	210846,30
Contoso Rechargeable Li-Ion Battery Pack E300 Black	211658,6598
The Phone Company Smart phones -320 x 320 M86 Black	211824,00
MGS Freelancer 2009 E153	212951,91
Contoso Travel Charger for S-Series Battery E302 Black	214677,8144
Contoso Carrying Case E312 Pink	214756,0576
The Phone Company Microsoft Windows Mobile M200 Gold	215239,39
MGS Age of Mythology: The Titans Expansion 2009 E148	215609,74
NT Wireless Transmitter and Bluetooth Headphones M150 Black	215642,1229
Litware 17'' Oscillating Pedestal Fan M125 Pink	217606,20
SV 8xDVD E130 Silver	217719,884
Contoso Travel Charger for S-Series Battery E302 White	218379,1974
SV 22xDVD M600 Silver	218460,624
A. Datum All in One Digital Camera M200 Azure	218713,56
SV 2GB Laptop memory E800 White	219667,25
NT Wireless Transmitter and Bluetooth Headphones M150 Green	219822,3442
MGS Halo 2 for Windows Vista 2009 E130	219912,32
MGS Zoo Tycoon 2: African Adventure 2008 E136	220107,54
The Phone Company PDA Wifi 4.7-inch L290 Silver	220362,00
Contoso 8GB Super-Slim MP3/Video Player M800 Pink	220879,6545
MGS Dungeon Siege: Legends of Aranna 2009 E146	221833,56
MGS Halo: Combat Evolved2009 E149	222589,50
Contoso 4G MP3 Player E400 Black	223554,5347
The Phone Company Microsoft Windows Mobile M200 Grey	224358,17
Adventure Works CRT17 E105 Black	224396,47
SV 4GB Laptop Memory M65 White	225093,12
The Phone Company PDA Phone 3.7 inches M340 White	225109,50
Contoso 4GB Flash MP3 Player E401 Silver	225295,304
SV 2GB Laptop memory E800 Silver	225627,60
Litware 18'' Oscillating Pedestal Fan M135 Yellow	226051,00
MGS Shadow-run 2008 E131	226082,39
The Phone Company Microsoft Windows Mobile M200 Black	227232,12
MGS Age of Empires III 2008 E139	227278,22
NT Wireless Transmitter and Bluetooth Headphones M150 Blue	227356,3419
Contoso Telephoto Conversion Lens M350 Silver	227535,45
MGS Rise of Nations2009 E152	228467,17
Contoso 8GB MP3 Player new model M820 White	228666,98
WWI Stereo Bluetooth Headphones E1000 Blue	228903,88
A. Datum SLR-like Digital Camera M400 Grey	229319,585
The Phone Company Touch Screen Phones 5-Wire/Built-in M500 Gold	229373,44
MGS Kings & Myths: The Age Collection2009 E147	229554,64
MGS Zoo Tycoon 2008 E142	230347,56
Litware 18'' Oscillating Pedestal Fan M135 Pink	230832,00
Contoso Telephoto Conversion Lens M350 White	230975,40
Proseware CRT17 E104 White	231509,51
Contoso Macro Zoom Lens X300 Silver	231879,53
Contoso Travel Charger for S-Series Battery E302 Silver	232107,9089
MGS Dungeon 2007 E141	232727,18
Contoso Wireless Laser Mouse M55 Silver	232793,739
MGS Rise of Nations: Thrones and Patriots2009 E145	234106,19
The Phone Company Smart phones 4 GB of Memory M300 Pink	234368,18
Contoso Telephoto Conversion Lens M350 Black	234395,40
SV 2GB Laptop memory E800 Black	234905,55
Contoso 8GB Super-Slim MP3/Video Player M800 Red	235057,707
Contoso In-Line Coupler E180 White	235098,31
The Phone Company PDA Handheld 3.7 inch M630 Silver	236835,76
SV 4GB Laptop Memory M65 Yellow	237521,40
SV 8xDVD E130 Black	237539,292
Adventure Works CRT19 E10 Black	239541,78
Contoso 4G MP3 Player E400 Orange	240037,987
Proseware CRT17 E104 Black	240357,15
MGS Zoo Tycoon 2: End Range Species Expansion Pack 2008 E138	240882,13
Reusable Phone Screen Protector E120	241181,136
SV 4GB Laptop Memory M65 Blue	243051,40
The Phone Company PDA GPS Phone 3.7 inch M930 Black	244190,14
The Phone Company Smart phones 4 GB of Memory M300 White	244269,95
MGS Zoo Tycoon 2: Extinct Animals 2008 E129	244415,44
MGS Impossible Creatures2009 E154	245059,15
Contoso 8GB Super-Slim MP3/Video Player M800 Green	245217,087
Contoso 8GB Super-Slim MP3/Video Player M800 White	246107,682
Litware 17'' Oscillating Pedestal Fan M125 White	247640,40
Contoso Lens Adapter M450 Silver	248063,32
Contoso 8GB MP3 Player new model M820 Black	249321,74
Proseware Screen 125in X1609 White	249631,74
The Phone Company Touch Screen Phones 4-Wire/ Built-in M205 Gold	249982,36
MGS Dal of Honor Airborne M150	252307,4023
A. Datum Full Frame Digital Camera X300 Silver	252566,16
Proseware Laser Jet Printer E100 Black	253298,49
Litware 17'' Oscillating Pedestal Fan M125 Yellow	253698,90
The Phone Company Smart phones 4 GB of Memory M300 Black	254828,97
SV 8xDVD E100 Black	255800,94
Contoso Original K1m Li-Ion Standard Battery E170 White	256097,492
The Phone Company PDA Handheld 3.5 inch M610 White	257700,45
WWI Stereo Bluetooth Headphones E1000 Silver	258582,796
Contoso Touch Screen Phones 5-Wire/Built-in M500 Black	258595,84
Contoso Lens Adapter M450 White	258751,56
MGS Train Simulator E124	258813,3184
Fabrikam SLR Camera M148 Gold	260586,80
Contoso Telephoto Conversion Lens M350 Blue	260786,40
Contoso In-Line Coupler E180 Black	263092,25
WWI Stereo Bluetooth Headphones E1000 White	263521,868
Litware 3-Speed Oscillating Blower Fan M115 Silver	264104,3454
The Phone Company Touch Screen Phones 5-Wire/Built-in M500 Grey	264307,20
WWI Stereo Bluetooth Headphones E1000 Black	265431,984
Proseware Screen 125in X1609 Black	266582,61
WWI Stereo Bluetooth Headphones E1000 Green	267646,748
Adventure Works CRT17 E105 White	269108,44
SV 8xDVD E100 Silver	269163,48
Contoso Lens Adapter M450 Grey	269733,56
The Phone Company PDA Palm 3.7 inch M830 White	270260,12
Litware Desk Lamp E1030 White	270865,803
MGS Halo 2 for Windows Vista M220	272545,5177
Contoso 8GB MP3 Player new model M820 Yellow	274310,06
SV 8xDVD E140 Silver	274532,94
SV Hand Games for Office worker L28 Yellow	274880,3605
SV 4GB Laptop Memory M65 Black	275416,91
WWI Desk Lamp E130 Blue	275965,8135
Contoso 4GB Portable MP3 Player M450 Yellow	276302,4175
Contoso Genuine Leather Grip Belt E322 White	277872,9107
Contoso 4GB Flash MP3 Player E401 Blue	278325,1096
Proseware Ink Jet Fax Machine E100 Black	278484,18
Proseware CRT19 E201 Black	278525,40
A. Datum Rangefinder Digital Camera X200 Azure	279096,00
Adventure Works CRT19 E10 White	281119,80
The Phone Company Smart phones 4 GB of Memory M300 Gold	281150,04
Contoso Genuine Leather Grip Belt E322 Silver	282520,3348
A. Datum Rangefinder Digital Camera X200 Black	282560,00
MGS Flight Simulator X M250	282891,7966
MGS Zoo Tycoon 2: End range Species Expansion Pack E105	283054,80
A. Datum Ultra Compact Digital Camera M190 Grey	283202,70
Adventure Works Desk Lamp E1300 Black	284630,7945
Contoso Lens Adapter M450 Black	284934,28
Contoso Genuine Leather Grip Belt E322 Black	285059,6892
MGS Hand Games for Office worker L299 Red	285373,44
SV 8xDVD E140 Black	286386,54
Proseware CRT19 E201 White	286668,78
The Phone Company PDA Phone Unlocked 3.7 inches M510 Silver	287361,20
Contoso 4GB Flash MP3 Player E401 Black	287859,5528
Contoso 8GB MP3 Player new model M820 Blue	288081,24
MGS Zoo Tycoon 2: Marine Mania Expansion Pack M270	289764,5366
Litware Desk Lamp E1030 Black	290391,9915
Contoso Original K1m Li-Ion Standard Battery E170 Black	291296,068
Contoso SLR Camera M145 Pink	291882,71
MGS Rise of Nations: Rise of Legends M290	292366,3596
Contoso Touch Screen Phones 4-Wire/ Built-in M205 Black	292899,88
MGS Fable: The Lost Chapters E107	294007,84
Litware 3-Speed Oscillating Blower Fan M115 White	296093,182
MGS King& Myths: The Age Collection M340	296253,846
Proseware Desk Lamp E0130 Silver	296602,5075
Litware 3-Speed Oscillating Blower Fan M115 Black	296807,9254
SV Hand Games for Office worker L28 Red	298013,095
Proseware Duplex Scanner M200 Black	298980,42
Contoso Genuine Leather Grip Belt E322 Grey	299560,3699
MGS Flight Simulator X Acceleration Expansion Pack M200	299617,8016
Proseware Ink Jet Instant PDF Sheet-Fed Scanner M300 Green	301545,60
Litware Desk Lamp E1030 Silver	302266,965
Proseware Laser Jet Printer E100 Grey	302554,20
SV 40GB USB2.0 Portable Hard Disk E400 Yellow	302573,9424
Proseware Ink Jet Fax Machine E100 White	302822,52
Proseware Duplex Scanner M200 White	302833,56
MGS Hand Games for Office worker L299 Silver	303386,625
MGS Age of Empires III: The Asian Dynasties E106	303483,04
Adventure Works Desk Lamp E1300 Silver	303756,4335
SV 8xDVD E120 Silver	305553,019
MGS MechWarrior 4: Knight E121	305776,35
Adventure Works Desk Lamp E1300 Grey	306042,204
Proseware Desk Lamp E0130 Black	306732,972
MGS MechCommander 2 E123	307921,796
MGS Rise of Nations: Gold Edition M300	308467,60
Proseware Desk Lamp E0130 Grey	308764,5015
SV 16xDVD E340 Silver	309703,68
SV Wireless LAN PCI Network Card Adapter E900 Black	309908,61
Proseware Fax Machine E100 White	310214,83
MGS Hand Games for Office worker L299 Yellow	310584,2985
Proseware Fax Machine E100 Black	312889,77
MGS Age of Empires III: The Asian Dynasties M190	314377,3614
Proseware Ink Jet Fax Machine E100 Grey	314466,36
SV 16xDVD E340 Black	315287,28
Contoso 4GB Flash MP3 Player E401 White	315707,8328
SV Hand Games for Office worker L28 Black	316402,2215
Proseware Desk Lamp E0130 Blue	318240,975
SV 40GB USB2.0 Portable Hard Disk E400 Blue	318467,2509
MGS Shadow-run M230	318697,3694
WWI Desk Lamp E130 White	319012,4925
Fabrikam Microwave 0.8CuFt E0800 Red	319136,9531
MGS Collector's M160	319459,6825
Contoso In-Line Coupler E180 Silver	319769,56
Proseware Desk Lamp E0130 White	320549,1315
Adventure Works LCD17 E200 White	321031,26
MGS Gears of War M170	322297,1423
A. Datum SLR Camera X139 Gold	323469,30
WWI Desk Lamp E130 Grey	323544,0585
Adventure Works Desk Lamp E1300 White	323762,322
SV 40GB USB2.0 Portable Hard Disk E400 Red	323986,4046
Contoso Multimedia Speakers M25 Brown	325220,61
WWI Desk Lamp E130 Black	326096,0625
Proseware Laser Jet Printer E100 White	326390,87
Litware Desk Lamp E1030 Grey	327363,27
Proseware Laser Fax Printer E100 White	327764,71
MGS Age of Empires III: The War Chiefs M240	327819,8798
MGS Age of Mythology: The Titans Expansion M350	327833,352
A. Datum Slim Digital Camera M180 Orange	328200,36
Adventure Works Desk Lamp E1300 Blue	328500,159
Adventure Works LCD15 E100 Black	328598,82
Proseware Duplex Scanner M200 Grey	328938,36
MGS Zoo Tycoon 2: African Adventure M280	330383,8326
MGS Zoo Tycoon 2: Extinct Animals M210	332686,2005
WWI Wireless Transmitter and Bluetooth Headphones X250 Black	332744,1897
A. Datum Interchangeable lens Non-SLR Digital Camera X250 Grey	333834,20
SV 16xDVD M310 Silver	334080,33
Adventure Works CRT15 E101 White	336412,80
SV 8xDVD E120 Black	338857,373
WWI Screen 125in M1611 White	339604,92
The Phone Company Touch Screen Phones 5-Wire/Built-in M500 Black	339750,40
MGS Age of Empires III: The Asian Dynasties M180	340124,1883
Proseware Fax Machine E100 Grey	340909,49
SV 16xDVD M310 Black	341050,20
MGS Dungeon Siege: Legends of Aranna M330	341879,0016
MGS Combat Flight Simulator 2 M400	341973,1813
Contoso Telephoto Conversion Lens X400 White	342446,30
WWI Wireless Transmitter and Bluetooth Headphones X250 Red	343486,26
Contoso Multimedia Speakers M25 Black	344444,19
Contoso Original K1m Li-Ion Standard Battery E170 Silver	345275,392
MGS Zoo Tycoon 2: Zookeeper Collection M260	345581,7049
Contoso Microwave 0.8CuFt E0080 Black	345619,2152
Contoso Rubberized Snap-On Cover Hard Case Cell Phone Protector E160 White	345916,668
Proseware Wall Lamp E0315 Blue	347357,542
Contoso Rubberized Snap-On Cover Hard Case Cell Phone Protector E160 Silver	347492,244
MGS Hand Games for Office worker L299 Black	348905,175
WWI Wireless Transmitter and Bluetooth Headphones X250 Blue	348921,0426
Adventure Works Laptop12 M1200 Black	350069,913
The Phone Company Touch Screen Phones 4-Wire/ Built-in M205 Grey	350115,20
Proseware Laser Fax Printer E100 Black	350553,84
Fabrikam Laptop8.9 M0801 Silver	351628,09
MGS Zoo Tycoon M380	354443,39
Litware Microwave 0.8CuFt E080 White	354691,7101
MGS Racing Madness 2 M370	354990,74
Litware Microwave 0.8CuFt E080 Silver	355314,8445
Fabrikam Microwave 0.8CuFt E0800 Grey	355340,4918
WWI Desk Lamp E130 Silver	355356,1635
Fabrikam Microwave 0.8CuFt E0800 Black	355415,5339
The Phone Company Touch Screen Phones 4-Wire/ Built-in M205 Black	357300,28
Contoso Microwave 0.8CuFt E0080 Silver	358344,0756
Litware Microwave 0.8CuFt E080 Black	359371,8674
Proseware Photo Inkjet Printer E290 Black	360370,08
WWI Wall Lamp E215 Grey	360621,5457
Adventure Works Wall Lamp E3150 Blue	361393,4058
Adventure Works CRT15 E101 Black	361530,00
WWI Wireless Transmitter and Bluetooth Headphones X250 Silver	361695,5316
Contoso Microwave 0.8CuFt E0080 White	363668,2651
SV Wireless LAN PCI Network Card Adapter E901 Black	364762,53
Litware Microwave 0.8CuFt E080 Grey	364908,8345
MGS Age of Mythology: Gold Edition M310	366395,316
Contoso Microwave 0.9CuFt E0090 Silver	368745,1218
Contoso Multimedia Speakers M25 Blue	369806,88
MGS Zoo Tycoon Dinosaur Digs X200	370628,34
Adventure Works LCD24 X300 White	370843,20
Contoso Microwave 0.9CuFt E0090 Red	371594,8368
Contoso Multimedia Speakers M25 White	372531,36
Proseware Photo Ink jet Printer E290 White	372635,58
MGS Bicycle Board Games X500	374556,70
SV Wireless LAN PCI Network Card Adapter E902 Black	375232,77
Adventure Works LCD15 E100 White	375238,71
Fabrikam Microwave 0.8CuFt E0800 Blue	375368,1834
Contoso 32GB Video MP3 Player M3200 Pink	375617,55
WWI LCD17 E200 Black	375906,96
Litware Microwave 0.9CuFt E090 Blue	375920,4042
The Phone Company PDA Palm 4.7 inch L850 White	377160,72
Proseware Air conditioner 25000BTU L167 White	377898,8981
WWI Wall Lamp E315 Black	378199,318
The Phone Company PDA Phone Unlocked 3.5 inches M530 White	378466,92
Contoso Microwave 0.9CuFt E0090 White	379065,0897
Litware Microwave 0.9CuFt E090 Silver	380852,9109
SV DVD 7-Inch Player Portable E200 Silver	382167,9543
WWI Wireless Transmitter and Bluetooth Headphones X250 White	382417,2027
Litware Microwave 0.8CuFt E080 Blue	382588,3733
Contoso Microwave 0.9CuFt E0090 Grey	383063,6898
Proseware Photo Ink Jet Printer E290 Grey	384604,26
SV 80GB USB2.0 Portable Hard Disk E500 Yellow	385656,90
SV DVD 7-Inch Player Portable E200 Black	385771,2267
Contoso Microwave 0.8CuFt E0080 Red	386219,841
MGS Flight Simulator 2002 M360	386904,36
Proseware Wall Lamp E0315 White	387138,7415
SV 80GB USB2.0 Portable Hard Disk E500 Blue	387171,60
WWI CRT17 E106 White	387212,76
SV 80GB USB2.0 Portable Hard Disk E500 Silver	388606,74
Proseware Laser Fax Printer E100 Grey	388849,37
SV 16xDVD M330 Black	388997,02
SV 80GB USB2.0 Portable Hard Disk E500 Red	390676,32
WWI Wall Lamp E315 White	390902,1725
The Phone Company PDA Wifi 3.7-inch M250 Silver	391049,50
Proseware Photo Smart All-in-One Printer M380 White	391125,84
Contoso Telephoto Conversion Lens X400 Black	391450,50
Proseware Laser Jet Color Printer X300 Grey	391697,35
Fabrikam Microwave 0.9CuFt E0900 Silver	391928,8032
MGS Flight Simulator 2000 M410	392039,445
WWI CRT17 E106 Black	393354,72
Contoso Microwave 0.8CuFt E0080 Grey	393760,1472
Litware Microwave 2.2CuFt M125 Silver	394130,2925
Proseware Laser Jet Color Printer X300 Black	394387,18
Proseware Wall Lamp E0315 Silver	394657,4443
Proseware LCD17 E200 White	394805,07
Adventure Works LCD17 E200 Black	396570,24
Contoso SLR Camera 35" X358 Gold	398185,04
Litware Microwave 0.9CuFt E090 White	398198,1762
Litware Microwave 0.9CuFt E090 Red	398774,1186
MGS Classic Flight Collection X400	399653,95
WWI Wall Lamp E315 Silver	399815,0786
Contoso 32GB Video MP3 Player M3200 Orange	400561,65
Litware Microwave 2.2CuFt M125 Blue	400707,9636
Fabrikam Microwave 2.2CuFt M1250 Silver	400851,9564
Proseware Air conditioner 25000BTU L167 Red	400959,8955
WWI 4GB Video Recording Pen X200 Black	402074,56
MGS Dungeon Siege X300	403358,86
WWI Screen 125in M1611 Silver	403566,57
The Phone Company PDA GPS Phone 4.7 inch L950 Silver	403754,88
Contoso Microwave 2.2CuFt M0125 Silver	403879,805
Fabrikam Microwave 0.8CuFt E0800 Silver	404532,0132
Litware Wall Lamp E3015 White	404662,6633
MGS MechWarrior 4 Mach Packs X100	404939,36
Litware Wall Lamp E2015 Silver	405014,246
Litware Microwave 0.9CuFt E090 Grey	405717,4242
Proseware Laser Jet Color Printer X300 White	405850,83
Proseware LCD15 E103 Black	406656,36
Proseware Mobile Receipt and Document Scanner M200 Grey	407555,56
MGS Age of Empires II Gold Edition E122	408136,63
Litware Home Theater System 7.1 Channel X711 Black	408555,60
