SV USB Data Cable E600 Black	3284,4825
SV USB Data Cable E600 Pink	3602,9605
SV USB Data Cable E600 Grey	3635,7355
SV USB Data Cable E600 Silver	3698,806
SV USB Sync Charge Cable E700 Silver	5370,1543
SV USB Sync Charge Cable E700 White	5642,645
SV USB Sync Charge Cable E700 Blue	5812,2726
SV USB Sync Charge Cable E700 Black	6441,2519
Contoso Smart Battery M901 Blue	10276,40
Contoso Digital Camera Accessory kit M200 Blue	16880,809
Litware 80mm Dual Ball Bearing Case Fan E1001 Green	18426,4732
Litware 80mm Dual Ball Bearing Case Fan E1001 Black	18496,2334
Litware 80mm Dual Ball Bearing Case Fan E1001 Pink	19048,0276
Litware 80mm Dual Ball Bearing Case Fan E1001 White	19682,7556
Contoso Reserve Pen - Tablet Pen E200 Grey	20127,20
Contoso Reserve Pen - Tablet Pen E200 Black	20187,526
Contoso Reserve Pen - Tablet Pen E200 Gold	20402,976
MGS Hand Games men M300 Silver	21482,331
Contoso General Soft Carrying Case E318 Black	22824,9732
MGS Hand Games men M300 Yellow	24078,1385
Contoso General Soft Carrying Case E318 Blue	24107,5176
Contoso 4-Line Corded Cordless Telephone M203 Black	24457,4664
Contoso Lens Cap Keeper E314 Pink	24535,2375
Contoso 4-Line Corded Cordless Telephone M203 White	24783,7375
Contoso Reserve Pen - Tablet Pen E200 White	25746,414
Contoso 4-Line Corded Cordless Telephone M203 Grey	26099,3787
SV Hand Games men M30 Black	26329,416
Contoso Lens Cap Keeper E314 White	26889,6195
Contoso Lens Cap Keeper E314 Silver	27273,2595
MGS Hand Games men M300 Red	27308,515
Contoso General Soft Carrying Case E318 White	28674,6708
Contoso Digital Cordless Expansion Handset Phone M900 White	29466,668
SV Hand Games men M30 Silver	29819,64
Contoso Lens Cap Keeper E314 Yellow	30031,228
SV Hand Games men M30 Red	30037,392
Contoso General Soft Carrying Case E318 Silver	30670,4394
Contoso Phone with Memory Dialing-2 lines E90 White	31703,36
Contoso Primary Extended Capacity Battery Pack - notebook battery X100 Black	31790,742
Contoso Digital Cordless Expansion Handset Phone M900 Grey	32141,1673
Contoso ADSL Modem Splitter/Filter X 2 E200 White	32359,99
Contoso USB Wave Multi-Media Keyboard M901 Gold	32545,163
SV Hand Games men M30 Yellow	32770,472
Contoso Primary Extended Capacity Battery Pack - notebook battery X100 White	32786,385
MGS Hand Games men M300 Black	32817,4145
Contoso Digital Cordless Expansion Handset Phone M900 Black	32871,5659
Contoso ADSL Modem Splitter/Filter X 2 E200 Grey	32982,87
Contoso Power Inverter - DC to AC power inverter E900 Grey	33094,01
Contoso Phone with Memory Dialing-2 lines E90 Grey	33616,64
Contoso Single-line phones E10 Black	34328,0376
Contoso Phone with Memory Dialing-2 lines E90 Black	34464,96
Contoso Single-line phones E10 Grey	34816,8483
Contoso Education Essentials Bundle M300 Black	34885,235
Contoso USB Optical Mouse E200 Gold	35056,195
Contoso Power Inverter - DC to AC power inverter E900 Black	35066,78
Contoso ADSL Modem Splitter/Filter X 1 E100 Grey	35293,609
Contoso DVD 38 DVD Storage Binder E25 Black	35461,7028
Contoso Education Essentials Bundle M300 White	36235,47
Contoso Laptop Starter Bundle M200 Black	36487,77
Contoso Single-line phones E10 White	36722,3409
Contoso Primary Extended Capacity Battery Pack - notebook battery X100 Grey	36866,928
Contoso Education Essentials Bundle M300 Grey	37539,155
Contoso DVD 38 DVD Storage Binder E25 Silver	37844,7174
Contoso Power Inverter - DC to AC power inverter E900 White	38014,345
Contoso Smart Battery M901 Black	38441,28
Contoso Laptop Starter Bundle M200 White	38709,33
Contoso DVD 38 DVD Storage Binder E25 Red	39070,0908
Litware 120mm Blue LED Case Fan E901 Black	39149,9109
Contoso Wireless Notebook Optical Mouse M35 Black	39349,8075
Litware 120mm Blue LED Case Fan E901 blue	39817,3428
Contoso Smart Battery M901 White	40004,935
Litware 120mm Blue LED Case Fan E901 White	40266,2934
Contoso Wireless Notebook Optical Mouse M35 White	40354,3305
Contoso Ultraportable Neoprene Sleeve E30 Pink	40399,32
Contoso 90W AC/DC Power Adapter E300 White	40706,806
SV DVD 38 DVD Storage Binder E25 Black	40998,96
Contoso Smart Battery M901 Grey	41060,98
Litware 120mm Blue LED Case Fan E901 Grey	41108,5503
Contoso USB Optical Mouse E200 Blue	41630,985
Contoso 512MB MP3 Player E51 Blue	41719,3335
SV DVD 38 DVD Storage Binder E25 Red	42009,4485
Contoso Laptop Starter Bundle M200 Grey	42192,48
Contoso Lens cap E80 Black	42965,671
Contoso Wireless Notebook Optical Mouse M35 Orange	42988,433
Contoso Lens cap E80 Grey	43822,84
SV DVD Player M140 Gold	43839,0021
Contoso Wireless Notebook Optical Mouse M35 Blue	44220,8755
Contoso Desktop Alternative Bundle E200 Grey	44352,05
Contoso ADSL Modem Splitter/Filter X 1 E100 White	44674,82
Contoso Cables To Go USB 2.0 Hard Drive Enclosure E920 Grey	45004,491
MGS Empires Collector's 2008 M440	45263,52
Contoso Cables To Go USB 2.0 Hard Drive Enclosure E920 Black	45377,437
Contoso Desktop Alternative Bundle E200 Black	45384,98
Contoso DVD 55DVD Storage Binder M56 Black	45498,3942
Contoso Expandable 2-Handset Cordless Phone System M205 Grey	45784,8499
Contoso Wireless Notebook Optical Mouse M35 Silver	45867,5265
MGS Dal of Honor Airborne 2008 M430	46041,78
Contoso Wireless Notebook Optical Mouse X205 White	46626,06
Contoso 90W AC/DC Power Adapter E300 Grey	46822,93
SV DVD Player M100 Black	46924,4262
SV DVD 38 DVD Storage Binder E25 Silver	46981,1718
Contoso Wireless Notebook Optical Mouse X205 Silver	47080,885
Contoso Wireless Notebook Optical Mouse X205 Blue	47093,88
SV DVD 55DVD Storage Binder M56 Red	47126,217
Contoso Rechargeable Battery E100 Black	47141,885
Contoso DVD 55DVD Storage Binder M56 Silver	47543,4906
Contoso Cables To Go USB 2.0 Hard Drive Enclosure E920 White	47714,359
Contoso DVD 55DVD Storage Binder M56 Red	47836,1898
Contoso Desktop Alternative Bundle E200 White	48104,615
Contoso Rechargeable Battery E100 White	48747,8145
SV DVD 55DVD Storage Binder M56 Black	48783,1578
Contoso Rechargeable Battery E100 Grey	48932,4815
Contoso Dual Handset Cordless Phone System E20 White	49043,2254
Contoso Optical Wheel OEM PS/2 Mouse E60 Black	49076,30
Contoso 90W AC/DC Power Adapter E300 Black	49160,566
Contoso 512MB MP3 Player E51 Silver	49231,9701
SV DVD Player M120 White	49244,2621
SV DVD Movies E100 Yellow	49847,826
Contoso Mouse Lock Bundle E200 White	49986,223
Contoso Dual Handset Cordless Phone System  E20 Black	50077,749
Contoso Mouse Lock Bundle E200 Black	50459,0275
Contoso Expandable 2-Handset Cordless Phone System M205 Black	50461,3583
Contoso Optical Wheel OEM PS/2 Mouse E60 Silver	50555,70
SV DVD 55DVD Storage Binder M56 Silver	50636,5818
Contoso Education Supplies Bundle E200 White	51111,675
Contoso Dual Handset Cordless Phone System E20 Grey	51241,1334
Contoso Education Supplies Bundle E200 Grey	51392,205
Contoso DVD Movies E100 Yellow	51969,4827
Contoso Phone with Memory Dialing-single line E88 White	52113,3426
Contoso DVD Player M100 Black	52125,3336
SV DVD 58 DVD Storage Binder M55 Red	52272,9315
Contoso DVD Player M140 Gold	52472,7465
Contoso Wireless Notebook Optical Mouse X205 Black	52577,77
SV DVD 58 DVD Storage Binder M55 Black	52795,0566
Contoso Expandable 2-Handset Cordless Phone System M205 White	52963,1858
Contoso Optical Wheel OEM PS/2 Mouse E60 Grey	52986,83
Litware USB Foam Fan E1301 White	53140,4165
Litware 92mm DBB Case Fan E1101 White	53252,5746
Contoso Education Supplies Bundle E200 Black	53474,715
Contoso Mouse Lock Bundle E200 Grey	53580,884
Litware 92mm DBB Case Fan E1101 Grey	53696,8782
Contoso Phone with Memory Dialing-single line E88 Grey	54057,9402
SV DVD 58 DVD Storage Binder M55 Silver	54272,8137
Contoso USB Wave Multi-media Keyboard E280 Blue	54280,374
Contoso Optical Wheel OEM PS/2 Mouse E60 White	54301,00
Contoso DVD 58 DVD Storage Binder M55 Red	54376,8498
Contoso Wireless Notebook Optical Mouse X205 Orange	54579,00
Contoso DVD 58 DVD Storage Binder M55 Black	54697,7088
SV 16xDVD M300 Black	54710,25
Contoso DVD Player M120 White	55116,7166
SV DVD Player M110 Silver	55596,1728
Contoso Phone with Memory Dialing-single line E88 Black	55814,8041
Contoso Phone System Accessory Handset with Charger M308 Black	56118,9575
Litware 92mm DBB Case Fan E1101 Silver	56306,1875
Contoso DVD Player M130 Grey	56313,2129
Litware Tower Fan E501 Silver	56341,1112
SV DVD Player M130 Grey	56442,7913
Litware Tower Fan E501 Yellow	56548,2594
Contoso DVD 58 DVD Storage Binder M55 Silver	56817,8784
Contoso Ultraportable Neoprene Sleeve E30 Yellow	56883,84
Contoso DVD Player M110 Silver	57019,2474
Litware 92mm DBB Case Fan E1101 Black	57463,8652
Litware USB Foam Fan E1301 Black	57555,6078
Contoso Reserve Pen -Tablet Pen E200 Blue	57794,671
Contoso USB Wave Multi-Media Keyboard E280 Grey	57848,97
Contoso Phone System Accessory Handset with Charger M308 Grey	57906,5052
Contoso ADSL Modem Splitter/Filter X 2 E200 Black	58007,303
Contoso DVD 48 DVD Storage Binder M50 Silver	58313,1458
Contoso Phone for MSN E200 Black	58461,76
Contoso Ultraportable Neoprene Sleeve E30 Black	58741,80
Contoso USB Optical Mouse E200 Grey	59324,235
SV DVD 48 DVD Storage Binder M50 Silver	59514,6979
Contoso Ultraportable Neoprene Sleeve E30 Green	59664,696
Litware USB Foam Fan E1301 Pink	59667,7512
Contoso ADSL Modem Splitter/Filter X 1 E100 Black	59908,078
Contoso 1G MP3 Player E100 White	59920,41
Litware 16" White Oscillating Stand Fan E701 Grey	60052,8142
Contoso USB Data Link - direct connect adapter E600 Grey	60182,928
Contoso General Carrying Case E304 Black	60321,824
Contoso USB Wave Multi-media Keyboard E280 White	60963,78
Contoso Phone System Accessory Handset with Charger M308 White	61015,4833
SV 16xDVD M300 Silver	61285,00
Litware Tower Fan E501 Black	61517,4168
Litware 16" White Oscillating Stand Fan E701 White	62548,7362
SV DVD 48 DVD Storage Binder M50 Black	62555,9074
SV DVD 48 DVD Storage Binder M50 Red	63038,9389
Litware USB Foam Fan E1301 Red	63464,8517
Contoso USB Optical Mouse E200 White	64451,48
Contoso USB Optical Mouse E200 Black	64721,49
Contoso Notebook Peripheral Kit M69 Black	65350,89
Contoso Phone with 13-Number Memory (210) M301 Grey	65379,5588
Contoso Lens cap E80 White	65392,83
Contoso DVD 48 DVD Storage Binder M50 Black	65513,4634
Contoso General Carrying Case E304 Silver	65546,0106
Litware Desktop Wind Tower Oscillating Fan E1201 Purple	65613,6215
Contoso Notebook Peripheral Kit M69 White	65910,735
Contoso Phone for MSN E200 White	66261,28
Litware Tower Fan E501 White	66294,6222
Litware 16" White Oscillating Stand Fan E701 Black	66344,3994
Contoso 3 Handset Cordless Phone System  E30 Black	66432,9388
Contoso USB Wave Multi-media Keyboard E280 Black	66551,994
Contoso Connectivity Starter Kit Smart Buy M680 Grey	66659,517
Contoso Notebook Peripheral Kit M69 Grey	66790,185
Litware Desktop Wind Tower Oscillating Fan E1201 Black	66977,2668
Contoso DVD 48 DVD Storage Binder M50 Red	67361,9359
Contoso USB Data Link-direct connect adapter E600 Black	67690,246
MGS Hand Games for kids E300 Red	67964,60
Contoso USB Data Link - direct connect adapter E600 White	68109,028
Contoso Car power adapter M90 Grey	68330,346
Contoso Connectivity Starter Kit Smart Buy M680 White	68429,493
Contoso Wireless Laser Mouse M55 Grey	68749,7772
Litware Desktop Wind Tower Oscillating Fan E1201 White	68773,3679
Contoso Wireless Laser Mouse E50 Silver	69133,6256
Contoso Wireless Laser Mouse E50 Black	69260,4336
Contoso ADSL Modem Splitter/Filter X 3 E300 Black	69601,588
Contoso Phone with 13-Number Memory (210) M301 White	70211,3449
SV 16xDVD M350 Black	70459,137
Contoso Phone with 13-Number Memory (210) M301 Black	70679,7592
Contoso 3 Handset Cordless Phone System E30 White	70705,0743
Contoso Battery charger - bike E200 Black	70886,785
Litware 16" White Oscillating Stand Fan E701 Silver	71113,7049
Contoso General Carrying Case E304 White	71972,5957
Contoso ADSL Modem Splitter/Filter X 3 E300 White	72095,294
Contoso 3 Handset Cordless Phone System E30 Grey	72135,2925
MGS Hand Games for kids E300 Yellow	73244,325
Contoso Laptop Cooling Hub notebook fan with 4 ports USB hub M200 Gold	73936,695
Contoso ADSL Modem Splitter/Filter X 3 E300 Grey	74000,752
Contoso General Carrying Case E304 Blue	74798,3821
SV DVD 60 DVD Storage Binder L20 Black	75038,2269
Contoso 4-Line Expandable Cordless Phone System M900 White	75339,00
MGS Hand Games for kids E300 Silver	75433,325
Contoso Connectivity Starter Kit Smart Buy M680 Black	75589,191
Contoso Car power adapter M90 White	75693,2925
SV Hand Games for kids E30 Silver	76289,2515
Contoso Bedroom Phone with AM/FM Stereo and Call Waiting Caller ID M600 Black	76392,33
Contoso Private Branch Exchange M88 White	76445,4177
Contoso Battery charger - bike E200 Grey	76477,292
Contoso Multi-line phones M30 Grey	76954,427
Contoso Leather Case - case for digital photo camera X20 Grey	76970,292
Contoso Leather Case - case for digital photo camera X20 Black	77312,235
Litware Desktop Wind Tower Oscillating Fan E1201 Brown	77622,5172
Contoso Car power adapter M90 Black	77694,078
SV DVD External DVD Burner M200 Silver	77872,3308
Contoso Leather Case - case for digital photo camera X20 White	78128,589
Contoso Private Branch Exchange M88 Grey	78217,6405
Litware 20'' Box Fan E401 Black	78514,2306
Contoso Wireless Laser Mouse E50 Grey	78541,312
Litware 20'' Box Fan E401 White	78713,8338
Contoso DVD 60 DVD Storage Binder L20 Red	79036,1943
SV Hand Games for kids E30 Yellow	79269,652
Contoso DVD External DVD Burner M200 Blue	79694,972
Contoso Waterproof Accessory Handset and Charging Cradle M609 Black	79696,2144
SV Hand Games for 12-16 boys E60 Yellow	79896,381
Contoso Wireless Laser Mouse E50 White	80272,8176
Contoso DVD 60 DVD Storage Binder L20 Silver	81042,045
Contoso 2G MP3 Player E200 Silver	81105,357
SV DVD 60 DVD Storage Binder L20 Red	81224,0205
MGS Hand Games for kids E300 Black	81731,65
Litware 20'' Box Fan E401 Yellow	81805,3443
Contoso DVD 60 DVD Storage Binder L20 Black	83198,5119
MGS Impossible Creatures E114	83745,76
SV DVD External DVD Burner M200 Grey	83791,7184
Contoso Cyber Shot Digital Cameras Adapter E306 Pink	84651,6318
WWI Stereo Bluetooth Headphones New Generation M370 Blue	85192,0641
Contoso 4-Line Expandable Cordless Phone System M900 Black	85209,96
Contoso Battery charger - bike E200 White	85250,605
Contoso Multi-line phones M30 White	85409,9191
Litware 20'' Box Fan E401 Blue	85638,8693
Litware 20'' Weather-Shield Performance Box Fan E1601 Orange	86006,5216
Contoso Digital camera accessory kit M200 White	86007,257
SV 160GB USB2.0 Portable Hard Disk M65 Grey	86161,355
MGS MechCollection2009 E156	86252,16
Contoso 2G MP3 Player E200 Blue	86411,3613
Contoso Bedroom Phone with AM/FM Stereo and Call Waiting Caller ID M600 White	86594,97
Contoso Multi-line phones M30 Black	86761,5012
Contoso Private Branch Exchange M88 Black	87074,1359
WWI Stereo Bluetooth Headphones New Generation M370 Black	87123,0789
Contoso 2G MP3 Player E200 Red	87378,3444
Contoso Expandable Cordless Phone System M008 White	88091,2428
Litware 20'' Weather-Shield Performance Box Fan E1601 Yellow	88310,6533
Litware 20'' Weather-Shield Performance Box Fan E1601 Black	88322,3494
Contoso DVD External DVD Burner M200 Silver	88511,8324
Contoso Lifestyles Series - Big Button Cordless phone M800 Black	88588,87
NT Bluetooth Active Headphones E202 Black	89226,522
SV DVD 60 DVD Storage Binder L20 Silver	89641,818
Contoso Lifestyles Series - Big Button Cordless phone M800 White	89752,67
Contoso Expandable Cordless Phone System M008 Black	90512,0898
Litware 20'' Weather-Shield Performance Box Fan E1601 White	90604,8883
SV DVD External DVD Burner M200 Blue	90847,2904
MGS MechWarrior 4:Knight2009 E171	91217,92
WWI Stereo Bluetooth Headphones New Generation M370 Orange	91413,3363
MGS Hand Games for 12-16 boys E600 Black	91519,594
SV 16xDVD M350 Silver	92253,973
Contoso Digital camera accessory kit M200 Grey	92263,082
Contoso Waterproof Accessory Handset and Charging Cradle M609 White	92294,5045
Contoso Cyber Shot Digital Cameras Adapter E306 Blue	92576,85
Contoso Bright Light battery E20 Pink	92648,98
MGS Flight Simulator 2009 E168	92715,52
MGS Hand Games for 12-16 boys E600 Silver	92859,409
SV Hand Games for kids E30 Red	93085,0305
Contoso 2G MP3 Player E200 Black	93450,9465
Contoso Mini Battery Charger Kit E320 Black	93873,1857
SV 160GB USB2.0 Portable Hard Disk M65 Black	94338,748
SV Hand Games for kids E30 Black	94510,955
NT Bluetooth Stereo Headphones E52 Yellow	95352,0316
NT Bluetooth Stereo Headphones E52 Black	95759,7319
Contoso USB Cable M250 Yellow	95854,75
Contoso Integrated Business Phone L08 White	95998,94
Adventure Works Desk Lamp E1200 White	96142,8417
Contoso USB Cable M250 Blue	96267,25
Contoso Home/Office Laptop Power Adapter E300 Black	96943,095
MGS Hand Games for 12-16 boys E600 Red	97066,2285
Contoso Bright Light battery E20 Black	97200,191
SV 500GB USB 2.0 Portable External Hard Drive X405 White	97444,02
Contoso KSU-less key system M38 White	97785,5797
Contoso Expandable Cordless Phone System M008 Grey	98223,1657
Proseware Laser Fax Printer M250 Grey	98981,94
Contoso Enhanced Capacity Battery M800 Grey	99464,895
Contoso USB 2.0 Dock Station docking station M800 Black	99473,712
Contoso Digital Camera/Camcorder USB Cable E324 White	99481,48
Contoso DVD External DVD Burner M200 Grey	100299,6732
SV Hand Games for 12-16 boys E60 Red	100406,262
SV DVD External DVD Burner M200 Black	100473,3132
MGS Hand Games for 12-16 boys E600 Yellow	100599,398
Contoso Digital Camera/Camcorder USB Cable E324 Silver	100639,84
Contoso DVD External DVD Burner M200 Black	101258,7448
Contoso Digital camera accessory kit M200 Black	101326,201
Contoso Expandable1-Handset Cordless Phone System M207 Grey	101726,0664
WWI Wireless Bluetooth Stereo Headphones M170 Pink	102150,00
Litware USB Durable Desk Soft Fan E1401 White	102460,50
Contoso Mini Battery Charger Kit E320 Silver	102519,7257
SV 22xDVD X680 Black	102537,37
Contoso 2-Line Corded Cordless Telephone M202 White	103073,945
Contoso Hybrid system M60 White	103173,6706
MGS RalliSport Challenge E115	103342,40
WWI 2GB Spy Video Recorder Pen M300 Purple	103358,24
WWI Desk Lamp E120 Black	103553,6706
Adventure Works Desk Lamp E1200 Black	103664,6336
Contoso Expandable1-Handset Cordless Phone System M207 White	103763,14
Contoso KSU-less key system M38 Grey	103794,3634
SV Rechargeable Bluetooth Notebook Mouse E80 Grey	103837,8908
Proseware Desk Lamp E0120 Silver	103884,4603
Contoso Mini Battery Charger Kit E320 Red	103993,386
Contoso Home/Office Laptop Power Adapter E300 White	104066,01
The Phone Company PDA Handheld 3.7 inch M630 White	104125,70
Contoso Hybrid system M60 Grey	104534,4612
Contoso Wireless Laser Mouse M55 White	104569,9593
WWI Wireless Bluetooth Stereo Headphones M170 Black	105153,60
Contoso KSU-less key system M38 Black	105678,5353
Contoso USB Cable M250 Black	105694,50
Contoso Integrated Business Phone L08 Black	105927,93
Contoso Mini Battery Charger Kit E320 White	106339,1973
MGS Age of Empires 2008new M420	106384,32
WWI Wireless Bluetooth Stereo Headphones M170 Silver	106491,60
Contoso Digital Cameras Lightweight Tripod E316 Silver	106784,1346
Contoso Digital Camera/Camcorder USB Cable E324 Purple	107147,60
WWI Stereo Bluetooth Headphones New Generation M370 Yellow	107265,7443
Contoso Home/Office Laptop Power Adapter E300 Grey	107429,97
WWI Desk Lamp E120 White	107518,9484
SV 500GB USB 2.0 Portable External Hard Drive X405 Blue	107788,43
SV 160GB USB2.0 Portable Hard Disk M65 Silver	108977,883
Contoso Enhanced Capacity Battery M800 White	109557,162
NT Bluetooth Stereo Headphones E52 Pink	110204,4482
Contoso Bright Light battery E20 White	110534,252
Contoso USB 2.0 Dock Station docking station M800 Grey	111359,56
SV Hand Games for 12-16 boys E60 Black	111642,138
Contoso 2-Line Corded Cordless Telephone M202 Black	111870,3807
Litware USB Durable Desk Soft Fan E1401 Red	112577,70
Contoso Enhanced Capacity Battery M800 Black	112916,043
Contoso Expandable1-Handset Cordless Phone System M207 Black	112923,3296
SV 22xDVD X680 Silver	113569,69
Proseware Desk Lamp E0120 Grey	114357,5681
Contoso Conversion Lens M550 Blue	114697,50
Contoso USB 2.0 Dock Station docking station M800 White	115328,187
Contoso Hybrid system M60 Black	115428,6133
Contoso Cyber Shot Digital Cameras Adapter E306 Black	115482,3222
Litware 3-Speed Oscillating High-Performance Fan E201 Black	115788,6909
Contoso Laptop Cooling Hub notebook fan with 4 ports USB hub E80 White	116016,186
Contoso Conversion Lens M550 Silver	116163,25
MGS Halo: Combat Evolved E109	116577,4668
SV 160GB USB2.0 Portable Hard Disk M65 White	116878,125
WWI Desk Lamp E120 Blue	117004,4855
Contoso Laptop Cooling Hub notebook fan with 4 ports USB hub E80 Black	117498,927
Litware Desk Lamp E1020 Black	117708,3508
Contoso Bright Light battery E20 blue	117743,183
Proseware Desk Lamp E0120 Blue	117790,8233
Proseware Color Ink Jet Fax with 5.8 GHz Cordless Handset X250 Green	117844,08
Litware Desk Lamp E1020 Silver	118344,4387
Contoso Laptop Cooling Hub notebook fan with 4 ports USB hub E80 Grey	118434,498
SV Hand Games for students E40 Red	118634,6295
Litware Desk Lamp E1020 White	118704,6186
SV Rechargeable Bluetooth Notebook Mouse E80 Black	119016,5606
MGS Hand Games for students E400 Black	119029,215
Proseware Laser Fax Printer M250 Black	119167,02
Contoso Bluetooth Notebook Mouse X305 Black	120219,00
SV 512MB Laptop memory E800 Black	120251,8614
SV Rechargeable Bluetooth Notebook Mouse E80 Silver	120552,3046
MGS Hand Games for students E400 Red	120910,5735
Adventure Works Desk Lamp E1200 Silver	120958,0672
Litware 80mm LED Dual PCI Slot Fan E1501 Yellow	121053,4479
NT Bluetooth Active Headphones E202 Silver	121220,2695
WWI 2GB Spy Video Recorder Pen M300 Black	121653,72
Proseware Desk Lamp E0120 White	121772,5956
MGS Rise of Nations: Rise of Legends 2008 E137	122158,70
NT Bluetooth Active Headphones E202 Red	122372,811
Litware Desk Lamp E1020 Grey	122514,2483
NT Wireless Bluetooth Stereo Headphones E302 Silver	122866,0945
Contoso 2-Line Speakerphone M109 White	123202,4076
MGS Bicycle Casino Games2009 E167	123424,32
Proseware Desk Lamp E0120 Black	123433,1419
Contoso 2-Line Corded Cordless Telephone M202 Grey	123450,4362
Litware 80mm LED Dual PCI Slot Fan E1501 White	123617,2506
Contoso Digital Camera/Camcorder USB Cable E324 Black	123808,72
Adventure Works Desk Lamp E1200 Blue	123950,4694
WWI Stereo Bluetooth Headphones New Generation M370 White	124049,0823
Contoso Expandable 3-Handset Cordless Phone System M204 White	124602,0587
Litware 80mm LED Dual PCI Slot Fan E1501 Blue	125201,1495
Contoso Bluetooth Notebook Mouse X305 Grey	125263,50
WWI Desk Lamp E120 Grey	125347,7035
WWI Desk Lamp E120 Silver	125685,9907
Litware 3-Speed Oscillating High-Performance Fan E201 Silver	126362,865
Litware USB Durable Desk Soft Fan E1401 Blue	126867,90
MGS Flight Simulator 2009 E179	127294,72
Litware Mobile Fan External USB Cooling Fan E601 White	127785,2147
WWI Wireless Bluetooth Stereo Headphones M170 White	128131,20
Contoso Wireless Laser Mouse M55 Black	128254,5753
Litware USB Durable Desk Soft Fan E1401 Black	128469,30
Litware 180 CFM Vertical Discharge Fan X450 White	128929,979
Contoso Private Automatic Branch Exchange M65 Black	129129,0315
Contoso Rechargeable Battery Pack E310 Silver	129253,3326
Fabrikam Laptop8.9 E0800 Silver	130742,40
Proseware Laser Fax Printer M250 White	130813,62
Litware 3-Speed Oscillating High-Performance Fan E201 White	130885,0571
MGS Age of Empires II: The Conquerors Expansion E125	131324,4596
SV 512MB Laptop memory E800 White	131347,557
SV Rechargeable Bluetooth Notebook Mouse E80 White	131499,2798
SV 512MB Laptop memory E800 Silver	131669,1024
NT Bluetooth Active Headphones E202 White	133057,254
Litware Mobile Fan External USB Cooling Fan E601 Pink	133784,6796
MGS Rise of Nations: Thrones and Patriots M320	134715,7632
SV Hand Games for students E40 Black	135060,081
Contoso 4 Handset Cordless Phone System M86 Black	135346,8732
Litware Mobile Fan External USB Cooling Fan E601 Black	135356,1638
Contoso 2-Line Speakerphone M109 Grey	135380,3439
SV Hand Games for students E40 Yellow	135404,688
MGS RalliSport Challenge2009 E155	135456,10
MGS Hand Games for students E400 Yellow	135792,2835
Contoso Expandable 3-Handset Cordless Phone System M204 Grey	135854,6921
Contoso Dual USB Power Adapter - power adapter E300 Black	135961,245
Contoso Centrex Phone System L10 Black	137050,8303
MGS Zoo Tycoon Marine Mania E120	137187,40
Litware 80mm LED Dual PCI Slot Fan E1501 Pink	137211,324
Contoso Multi-Use Terminal Cable E308 Black	137281,7268
NT Wireless Bluetooth Stereo Headphones E302 White	138410,126
Contoso Expandable 3-Handset Cordless Phone System M204 Black	138505,7155
Contoso Conversion Lens M550 Black	138908,00
MGS Rise of Nations E112	139243,44
Litware 18'' Adjustable Oscillating Pedestal Fan E301 White	139621,7934
Litware 80mm LED Dual PCI Slot Fan E1501 Red	140178,3066
Litware Mobile Fan External USB Cooling Fan E601 Silver	140549,8237
Contoso Multi-Use Terminal Cable E308 White	140782,8303
Contoso Centrex Phone System L10 Grey	141199,7952
MGS Hand Games for students E400 Silver	141214,077
Proseware Desk Jet All-in-One Printer, Scanner, Copier M350 Grey	141233,04
SV Hand Games for students E40 Silver	141516,744
Contoso Rechargeable Battery Pack E310 Black	141560,3742
NT Wireless Bluetooth Stereo Headphones E302 Black	142364,1565
Contoso Integrated Business Phone With card L10 White	142628,22
A. Datum Consumer Digital Camera M300 Silver	142817,76
Contoso Digital Cameras Lightweight Tripod E316 Black	143176,6089
