Litware Home Theater System 4.1 Channel M410 Black	1277451,36
A. Datum SLR Camera M135 Black	1287645,84
Fabrikam SLR Camera M147 Grey	1288227,98
Litware Home Theater System 5.1 Channel M510 Silver	1291719,33
Fabrikam SLR Camera 35" M358 Grey	1292083,84
Proseware Laptop12 M210 Black	1304848,512
Fabrikam SLR Camera X148 Gold	1309243,32
The Phone Company PDA Handheld 4.7 inch L650 White	1314730,53
Fabrikam Coffee Maker Super-Auto 12C X125 White	1319406,00
The Phone Company PDA Handheld 4.7 inch L650 Black	1321938,70
Contoso Home Theater System 2.1 Channel M1210 Silver	1323205,10
Contoso Air conditioner 8000BTU M0320 Silver	1323846,903
Fabrikam Laptop12 M2002 Red	1324347,36
Adventure Works Coffee Maker Auto 10C M100 Grey	1328526,1311
Litware Home Theater System 5.1 Channel M510 Brown	1335101,04
Proseware Laptop12 M210 White	1337445,216
A. Datum SLR Camera 35" M358 Gold	1338216,36
Litware Home Theater System 2.1 Channel E212 Brown	1338330,741
Contoso SLR Camera M145 Blue	1344155,26
Fabrikam SLR Camera 35" M358 Silver Grey	1345147,68
Proseware Laptop19W X910 White	1345218,42
A. Datum SLR Camera 35" X358 Silver	1345432,20
Contoso SLR Camera 35" M358 Pink	1346455,90
Litware Home Theater System 5.1 Channel M510 Black	1347689,34
A. Datum SLR Camera 35" M358 Pink	1349860,46
WWI Laptop12 M0120 Black	1350002,1465
Fabrikam SLR Camera M147 Silver	1350569,08
Contoso SLR Camera 35" M358 Grey	1360131,50
Contoso Coffee Maker Auto 10C M1000 Grey	1360954,3164
A. Datum SLR Camera 35" M358 Blue	1361014,46
Fabrikam Laptop10.1 M0100 White	1361201,15
SV Car Video TFT7 M7000 Silver	1368191,11
A. Datum SLR Camera 35" M358 Black	1369234,62
Adventure Works Laptop12 M1201 White	1369582,38
Adventure Works Coffee Maker Super-Auto 12C X125 Black	1370886,00
Litware Home Theater System 2.1 Channel E212 Black	1372633,303
SV Car Video LCD7 M7003 Silver	1375849,71
Fabrikam Coffee Maker Super-Auto 12C X125 Grey	1377948,00
Fabrikam SLR Camera 35" M358 Blue	1378318,32
SV Car Video TFT7 M7001 Silver	1385027,61
Litware Home Theater System 4.1 Channel M410 Brown	1387865,03
The Phone Company PDA Handheld 4.7 inch L650 Silver	1391853,67
Fabrikam SLR Camera 35" M358 Orange	1393668,72
Proseware Air conditioner 8000BTU M320 Grey	1396405,089
SV Car Video LCD7 M7003 Black	1399129,92
Contoso SLR Camera 35" M358 Black	1405200,12
Contoso Air conditioner 8000BTU M0320 White	1405948,8504
Fabrikam Laptop12 M2001 Silver	1408210,5465
Fabrikam Laptop12 M2000 White	1412719,74
Contoso Home Theater System 5.1 Channel M1530 Black	1413888,42
Fabrikam Coffee Maker Auto 10C M100 Grey	1415090,8107
Litware Home Theater System 5.1 Channel M514 Black	1417054,30
Proseware Air conditioner 8000BTU M320 White	1418284,542
The Phone Company PDA Palm 4.7 inch L850 Black	1419236,16
A. Datum SLR Camera 35" M358 Silver Grey	1420107,00
The Phone Company PDA Wifi 4.7-inch L290 White	1421656,00
Fabrikam Laptop13.3 M3000 Red	1426782,20
Fabrikam Laptop8.9 E8002 Red	1429151,40
SV Car Video LCD9.2W X9281 Brown	1431182,17
The Phone Company PDA GPS Phone 4.7 inch L950 Black	1433602,88
WWI Laptop8.9 E0089 Black	1434334,80
The Phone Company PDA Palm 4.7 inch L850 Silver	1434622,84
WWI Desktop PC1.60 E1600 Black	1442124,17
Fabrikam Budget Moviemaker 1/2'' 3mm E300 White	1454781,60
Litware Refrigerator 19CuFt M760 Orange	1456622,73
The Phone Company PDA Phone 4.7 inches L360 White	1463022,72
Fabrikam SLR Camera 35" X358 Silver	1467512,022
Contoso Air conditioner 8000BTU M0320 Blue	1467987,2994
Contoso Coffee Maker 12C M1000 Black	1473217,00
Contoso Coffee Maker Auto 10C M1000 Silver	1474561,1335
Fabrikam Budget Movie-Maker 2/3'' 17mm E100 Black	1477422,70
Contoso Home Theater System 5.1 Channel M1530 Silver	1477967,82
Proseware Air conditioner 8000BTU M320 Red	1481754,9552
Contoso Home Theater System 5.1 Channel M1530 White	1482899,46
Fabrikam SLR Camera 35" X358 Green	1485012,366
WWI Desktop PC1.80 E1800 Silver	1485931,062
Proseware Laptop8.9 E089 White	1489741,76
Fabrikam SLR Camera M150 Orange	1494589,03
The Phone Company PDA Wifi 4.7-inch L290 Black	1495338,00
WWI Desktop PC1.60 E1600 White	1496988,498
Fabrikam SLR Camera 35" M358 Gold	1500193,28
Contoso SLR Camera 35" M358 Orange	1501631,00
Adventure Works Coffee Maker Auto 10C M100 Silver	1504699,1295
Adventure Works Coffee Maker Auto 10C M100 White	1506974,399
WWI Desktop PC1.80 E1800 White	1507100,254
Fabrikam Laptop13.3W M3080 Red	1510253,60
Adventure Works Laptop12 M1201 Red	1521625,0185
WWI Desktop PC1.80 E1800 Black	1522420,79
Proseware Floor Lamp X0115 Blue	1525778,1694
WWI Desktop PC1.60 E1600 Silver	1529136,39
Fabrikam Budget Moviemaker 1/3'' 8.5mm E200 White	1529478,96
Fabrikam SLR Camera 35" X358 Gold	1530656,334
WWI Desktop PC1.60 E1600 Red	1534507,569
Litware Home Theater System 5.1 Channel M512 Silver	1535584,17
Fabrikam Budget Movie-Maker 1/3'' 8.5mm E200 Black	1537070,13
Adventure Works Laptop8.9 E0890 Silver	1537347,54
Fabrikam Coffee Maker Auto 10C M100 Silver	1540999,0029
Fabrikam Budget Movie-Maker 1/2'' 3mm E300 Black	1545894,72
Adventure Works Coffee Maker 12C M100 Grey	1546210,35
WWI Laptop12 M0120 White	1548132,8175
Contoso Coffee Maker Auto 10C M1000 Black	1548981,0959
Contoso Home Theater System 5.1 Channel M1530 Brown	1550829,21
Adventure Works Laptop12 M1201 Blue	1551016,431
Proseware Floor Lamp X0115 Grey	1551694,7619
Fabrikam SLR Camera 35" X358 Grey	1554686,592
Litware Home Theater System 5.1 Channel M512 Brown	1558902,81
Proseware Laptop15.4W M518 Black	1559206,00
Contoso Home Theater System 4.1 Channel M1400 Brown	1563341,15
Fabrikam Refrigerator 9.7CuFt M5600 Green	1565107,38
Fabrikam Budget Moviemaker 1/2'' 3mm E300 Grey	1565161,92
Fabrikam Budget Moviemaker 1'' 25mm E400 White	1568620,42
Fabrikam Refrigerator 19CuFt M7600 Grey	1570481,08
Fabrikam Budget Moviemaker 2/3'' 17mm E100 White	1571095,40
Adventure Works 52" LCD HDTV X590 Black	1571736,5802
Contoso Coffee Maker 12C M1000 Grey	1574984,05
Fabrikam SLR Camera 35" X358 Pink	1581277,344
Fabrikam Coffee Maker Auto 10C M100 White	1587906,8541
Fabrikam SLR Camera 35" X358 Black	1598018,70
Contoso Projector 1080p X981 Silver	1603508,34
Fabrikam Refrigerator 9.7CuFt M5600 Orange	1606420,78
Fabrikam SLR Camera M150 Green	1606609,726
A. Datum SLR Camera X142 Orange	1606929,10
Contoso Home Theater System 4.1 Channel M1400 White	1609635,86
SV Car Video LCD9.2W X9281 Silver	1612916,14
Contoso Home Theater System 4.1 Channel M1420 Black	1615156,80
Litware Refrigerator 9.7CuFt M560 Green	1619302,87
Contoso Home Theater System 5.1 Channel M1500 Brown	1620174,27
Adventure Works Laptop8.9 E0890 Black	1621093,68
Fabrikam Coffee Maker 12C M100 White	1622599,05
WWI Desktop PC1.80 E1801 Black	1629310,728
The Phone Company Touch Screen Phone 1600 TFT-1.4" L250 Grey	1630204,75
Contoso Water Heater 4.3GPM M1250 Red	1630693,35
Fabrikam Refrigerator 9.7CuFt M5600 Grey	1631627,87
A. Datum SLR Camera X136 Silver	1633095,66
Litware Refrigerator 19CuFt M760 Red	1635460,80
Adventure Works Coffee Maker 12C M100 White	1637760,20
Fabrikam Coffee Maker 12C M100 Black	1639553,55
Proseware Floor Lamp X0115 Black	1641013,1975
Contoso Projector 1080p X981 White	1644391,98
Contoso Home Theater System 5.1 Channel M1500 Black	1644773,13
Fabrikam Budget Moviemaker 2/3'' 17mm E100 Black	1646317,00
Adventure Works Desktop PC1.60 ED160 Brown	1647526,446
Fabrikam SLR Camera 35" X358 Silver Grey	1649991,93
Contoso SLR Camera X146 Orange	1654642,08
Litware Refrigerator 9.7CuFt M560 Silver	1657224,43
Fabrikam SLR Camera 35" X358 Blue	1657363,71
Litware Refrigerator 9.7CuFt M560 Grey	1660744,45
Contoso Coffee Maker 12C M1000 Silver	1660766,70
Fabrikam Laptop14.1W M4180 Red	1664477,562
Contoso Home Theater System 4.1 Channel M1420 White	1666574,40
Litware Refrigerator 9.7CuFt M560 Orange	1667488,69
Fabrikam Refrigerator 9.7CuFt M5600 Blue	1668637,38
Fabrikam Budget Movie-Maker 1'' 25mm E400 Black	1669195,68
Adventure Works Laptop8.9 E0890 Red	1672194,18
Adventure Works Desktop PC2.30 MD230 Brown	1674998,787
The Phone Company Touch Screen Phone 1600 TFT-1.4" L250 Gold	1675970,05
Litware Home Theater System 4.1 Channel M410 Silver	1676762,73
Fabrikam Coffee Maker 12C M100 Gold	1677191,65
Contoso Bluetooth Active Headphones L15 Black	1681498,644
Proseware Projector 480p DLP12 White	1683326,60
Adventure Works 26" 720p LCD HDTV M140 Brown	1683644,0265
Fabrikam Coffee Maker 12C M100 Silver	1684747,75
Fabrikam Refrigerator 9.7CuFt M5600 Brown	1687119,95
Fabrikam Laptop14.1 E4101 Red	1687603,50
Contoso Home Theater System 4.1 Channel M1400 Black	1689628,08
WWI Desktop PC1.80 E1800 Brown	1691337,516
Proseware Floor Lamp X0115 White	1691886,0376
Adventure Works Coffee Maker 12C M100 Black	1694190,65
Adventure Works Coffee Maker Auto 10C M100 Black	1696023,1848
Litware Refrigerator 9.7CuFt M560 Blue	1698010,32
Fabrikam Refrigerator 9.7CuFt M5600 Silver	1698961,81
SV Car Video LCD9.2W X9281 Black	1703726,64
Proseware Floor Lamp X0115 Silver	1704243,3233
WWI Projector 480p DLP12 Black	1704399,37
Litware Home Theater System 7.1 Channel M710 Black	1704770,37
Fabrikam Coffee Maker 12C M100 Grey	1704937,40
Proseware Laptop8.9 E089 Black	1706016,68
Contoso Home Theater System 4.1 Channel M1420 Brown	1707931,20
Litware Home Theater System 5.1 Channel M516 Black	1714303,20
Fabrikam Budget Moviemaker 1'' 25mm E400 Grey	1717898,70
Fabrikam Refrigerator 19CuFt M7600 Brown	1717989,00
Litware Home Theater System 5.1 Channel M512 Black	1727536,56
Contoso Bluetooth Active Headphones L15 Red	1732090,752
Fabrikam Budget Moviemaker 2/3'' 17mm E100 Grey	1734164,70
Contoso Home Theater System 4.1 Channel M1400 Silver	1734920,74
Litware Home Theater System 5.1 Channel M511 Black	1739293,74
Litware Refrigerator 9.7CuFt M560 White	1745831,32
Litware Refrigerator 19CuFt M760 White	1750712,60
Litware Home Theater System 5.1 Channel M516 Silver	1753727,31
Litware Home Theater System 5.1 Channel M516 Brown	1753889,43
Fabrikam Refrigerator 24.7CuFt X9800 Brown	1756698,5103
The Phone Company Touch Screen Phone 1600 TFT-1.4" L250 Black	1757216,71
WWI Laptop16 M0160 White	1758388,46
WWI Laptop8.9 E0089 White	1760497,80
Adventure Works Desktop PC1.60 ED160 White	1765176,055
Litware Home Theater System 5.1 Channel M511 Silver	1769581,41
Litware Refrigerator 9.7CuFt M560 Brown	1773197,75
Litware Refrigerator 19CuFt M760 Blue	1774041,65
Contoso Home Theater System 5.1 Channel M1500 Silver	1781538,33
Adventure Works 26" 720p LCD HDTV M140 White	1784508,9879
SV Car Video LCD7W M7081 Silver	1785357,13
Fabrikam SLR Camera 35" X358 Orange	1791870,342
Proseware Projector 480p DLP12 Silver	1796175,45
Contoso Home Theater System 4.1 Channel M1420 Silver	1796654,40
Contoso Coffee Maker Auto 10C M1000 White	1801700,1282
Fabrikam SLR Camera X150 Green	1802172,91
Fabrikam Refrigerator 19CuFt M7600 Orange	1802459,04
Contoso Projector 480p M481 White	1803141,49
Contoso Home Theater System 5.1 Channel M1500 White	1806192,96
WWI Desktop PC1.80 E1801 Brown	1808637,686
Fabrikam Refrigerator 19CuFt M7600 Silver	1810244,38
Fabrikam Refrigerator 19CuFt M7600 Green	1815063,02
Litware Refrigerator 9.7CuFt M560 Red	1820348,27
Fabrikam Home and Vacation Moviemaker 2/3" 17mm M103 Blue	1826635,30
Fabrikam Home and Vacation Moviemaker 1/2" 3mm M300 Orange	1828038,50
NT Bluetooth Stereo Headphones E52 Blue	1829070,1975
Adventure Works Coffee Maker 12C M100 Silver	1829288,20
Fabrikam Home and Vacation Moviemaker 1/2'' 3mm M300 White	1830874,16
Fabrikam Coffee Maker Auto 10C M100 Black	1832479,6756
Fabrikam Refrigerator 24.7CuFt X9800 Blue	1833914,269
Adventure Works Laptop8.9 E0890 White	1834532,40
Litware Refrigerator 19CuFt M760 Green	1836396,29
WWI Projector 480p DLP12 Silver	1840062,50
Litware Refrigerator 19CuFt M760 Grey	1844271,53
Contoso Water Heater 4.3GPM M1250 Yellow	1845435,15
Adventure Works 52" LCD HDTV X590 Silver	1845785,6352
WWI Desktop PC1.80 E1801 Silver	1848566,692
Adventure Works Desktop PC2.30 MD230 White	1849616,16
Fabrikam Refrigerator 9.7CuFt M5600 White	1850564,24
Contoso Air conditioner 25000BTU L1672 Red	1853535,6159
SV Car Video LCD7W M7080 Silver	1855030,00
Litware Home Theater System 5.1 Channel M511 Brown	1858249,56
Fabrikam Refrigerator 24.7CuFt X9800 Orange	1860090,1872
Fabrikam SLR Camera X150 Orange	1860303,80
SV Car Video LCD7W M7080 Brown	1863695,00
Litware Refrigerator 19CuFt M760 Silver	1865469,95
Fabrikam Refrigerator 19CuFt M7600 White	1868113,01
Contoso Water Heater 4.3GPM M1250 Silver	1872804,375
WWI Desktop PC2.30 M2300 White	1881308,91
Contoso Water Heater 2.6GPM E0900 Red	1885127,04
Contoso Water Heater 4.3GPM M1250 Grey	1891188,00
Contoso Coffee Maker 12C M1000 White	1896042,65
Contoso Water Heater 2.6GPM E0900 Grey	1896963,44
Adventure Works 26" 720p LCD HDTV M140 Black	1897649,5657
Litware Home Theater System 5.1 Channel M515 Brown	1898701,79
Fabrikam Budget Moviemaker 1/2'' 3mm E300 Black	1907939,16
Cigarette Lighter Adapter for Contoso Phones E110 Red	1910630,442
Contoso Water Heater 2.6GPM E0900 Blue	1917588,24
Contoso Water Heater 4.3GPM M1250 White	1922014,575
Contoso Bluetooth Active Headphones L15 White	1923124,056
Contoso Projector 1080p X981 Black	1925529,48
Litware Home Theater System 7.1 Channel M710 Brown	1925981,51
Litware Home Theater System 7.1 Channel M710 Silver	1928274,64
Contoso Air conditioner 25000BTU L1672 Blue	1932481,0546
Cigarette Lighter Adapter for Contoso Phones E110 White	1933596,252
Fabrikam Home and Vacation Moviemaker 1'' 25mm M400 Black	1937537,20
Adventure Works Desktop PC1.60 ED160 Black	1937706,499
Contoso SLR Camera 35" X358 Orange	1938924,80
Fabrikam Home and Vacation Moviemaker 1/3'' 8.5mm M200 Grey	1939746,21
Contoso Water Heater 4.3GPM M1250 Green	1942346,25
Fabrikam Home and Vacation Moviemaker 1" 25mm M400 Blue	1946868,00
Contoso Projector 480p M481 Silver	1948430,33
Contoso Water Heater 2.6GPM E0900 White	1954321,72
Contoso SLR Camera X145 Pink	1955825,12
Fabrikam Home and Vacation Moviemaker 1/2'' 3mm M300 Grey	1958241,14
SV Car Video LCD7W M7081 Brown	1966384,35
SV Car Video LCD7W M7080 Black	1967080,00
WWI Desktop PC1.80 E1802 White	1971350,664
WWI Desktop PC2.30 M2300 Silver	1976042,64
WWI Desktop PC1.80 E1801 White	1979392,62
Fabrikam Home and Vacation Moviemaker 1'' 25mm M400 Grey	1985988,00
SV Car Video LCD7W M7081 Black	1986434,17
Adventure Works Desktop PC1.60 ED160 Silver	1986805,005
Fabrikam Refrigerator 19CuFt M7600 Blue	1990134,28
Adventure Works Desktop PC2.30 MD230 Black	1993172,50
Contoso Air conditioner 25000BTU L1672 Silver	1994617,2776
Proseware Projector 480p DLP12 Black	1996184,63
Litware Refrigerator 19CuFt M760 Brown	2018246,01
WWI Desktop PC2.30 M2300 Black	2020432,83
Contoso Air conditioner 25000BTU L1672 Grey	2023503,9434
WWI Desktop PC2.30 M2300 Brown	2023993,66
Contoso Water Heater 2.6GPM E0900 Green	2024100,60
Fabrikam Refrigerator 24.7CuFt X9800 Silver	2029625,6574
Fabrikam Home and Vacation Moviemaker 1/3'' 8.5mm M200 Black	2031309,06
Contoso SLR Camera 35" X358 Silver Grey	2032928,80
Fabrikam Home and Vacation Moviemaker 1'' 25mm M400 White	2034054,00
Contoso Air conditioner 25000BTU L1672 White	2035371,5168
Fabrikam Home and vacation moviemaker 1/3" 8.5mm M200 Blue	2037278,85
Contoso Water Heater 4.3GPM M1250 Blue	2051121,15
Litware Refrigerator L1200 Orange	2063001,5531
SV Car Video LCD7W M7082 Brown	2083488,33
Proseware Laptop16 M610 White	2083681,40
WWI Floor Lamp X115 Grey	2084724,3408
Fabrikam Refrigerator 24.7CuFt X9800 White	2087321,4771
Proseware Laptop16 M610 Black	2093193,52
Adventure Works Laptop16 M1601 White	2094810,82
Fabrikam Home and vacation moviemaker 2/3'' 17mm M103 Black	2098318,70
A. Datum SLR Camera 35" X358 Grey	2100271,32
Fabrikam Laptop16 M6000 Black	2101896,99
Adventure Works 40" LCD HDTV M690 White	2103286,2009
Fabrikam Home and Vacation Moviemaker 1/2'' 3mm M300 Black	2120050,24
Contoso SLR Camera 35" X358 Silver	2126325,04
WWI Projector 480p DLP12 White	2132052,35
Contoso Projector 480p M481 Black	2132236,98
Contoso SLR Camera 35" X358 Black	2137974,72
Fabrikam SLR Camera X146 Black	2146236,06
WWI Floor Lamp X115 Silver	2150803,7018
A. Datum SLR Camera 35" X358 Gold	2160970,56
SV Car Video LCD7W M7082 Black	2166005,28
Contoso SLR Camera X145 Blue	2166262,16
Litware Home Theater System 5.1 Channel M515 Silver	2166581,30
Cigarette Lighter Adapter for Contoso Phones E110 Black	2170001,652
A. Datum SLR Camera 35" X358 Silver Grey	2171237,04
Contoso Water Heater 2.6GPM E0900 Silver	2177643,60
WWI Laptop16 M0160 Black	2197012,20
A. Datum SLR Camera 35" X358 Orange	2205058,80
WWI Floor Lamp X115 Blue	2208335,3572
Litware Microwave 1.5CuFt X110 Red	2208530,0754
Adventure Works Floor Lamp X1150 Grey	2216596,8673
Fabrikam Home and Vacation Moviemaker 2/3'' 17mm M103 Grey	2221556,95
A. Datum SLR Camera X138 Silver Grey	2235825,57
Fabrikam Home and Vacation Moviemaker 1/3'' 8.5mm M200 White	2244022,98
Adventure Works Floor Lamp X1150 White	2247951,1743
Litware Home Theater System 5.1 Channel M515 Black	2252477,54
Contoso SLR Camera 35" X358 Grey	2258004,48
WWI Floor Lamp X115 Black	2258572,2073
WWI Projector 720p LCD56 Silver	2263725,48
Litware Microwave 1.5CuFt X110 White	2275070,8002
Fabrikam SLR Camera X148 Silver Grey	2280046,23
Adventure Works Floor Lamp X1150 Silver	2280164,0678
Fabrikam Refrigerator 24.7CuFt X9800 Green	2285592,8575
A. Datum SLR Camera 35" X358 Blue	2309146,56
Fabrikam Home and Vacation Moviemaker 2/3'' 17mm M103 White	2309837,85
WWI Projector 1080p LCD86 Silver	2311546,95
Contoso SLR Camera X144 Silver Grey	2314043,20
Adventure Works Laptop15 M1501 Red	2314563,75
A. Datum SLR Camera 35" X358 Black	2314720,80
Adventure Works Laptop16 M1601 Silver	2332320,31
Adventure Works 40" LCD HDTV M690 Black	2340801,5877
Fabrikam Laptop14.1 M4100 White	2343150,30
Proseware Laptop15.4W M518 White	2343296,36
WWI Projector 1080p DLP86 Silver	2346436,05
Adventure Works 52" LCD HDTV X790W Black	2348128,794
Adventure Works Desktop PC2.30 MD230 Silver	2348852,71
Contoso Projector 720p M620 Silver	2357048,97
Fabrikam SLR Camera X147 Grey	2366034,15
Adventure Works Laptop16 M1601 Blue	2366846,67
Litware Home Theater System 5.1 Channel M513 Silver	2368575,30
Adventure Works Laptop15.4W M1548 White	2370986,10
WWI Floor Lamp X115 White	2380974,8427
Fabrikam Business Videographer 1/3" 8.5mm M380 Blue	2384362,32
Adventure Works Laptop16 M1601 Red	2386380,06
Litware Microwave 1.5CuFt X110 Silver	2392675,8042
Adventure Works 52" LCD HDTV X790W Silver	2395735,574
WWI Projector 720p LCD56 Black	2400268,14
WWI Projector 1080p LCD86 Black	2406927,15
Adventure Works Floor Lamp X1150 Blue	2410904,5321
Proseware Projector 720p LCD56 Black	2418190,50
Litware Microwave 1.5CuFt X110 Blue	2424913,9596
WWI Projector 1080p DLP86 Black	2433126,36
SV Car Video LCD7W M7082 Silver	2436672,06
Fabrikam SLR Camera X149 Blue	2438001,72
Litware Home Theater System 5.1 Channel M513 Brown	2472242,24
Proseware Projector 720p LCD56 White	2473041,03
Fabrikam SLR Camera X147 Silver	2475516,45
Litware Microwave 1.5CuFt X110 Black	2481632,0694
Contoso SLR Camera X144 Gold	2482972,93
Adventure Works 40" LCD HDTV M690 Silver	2484277,7553
Contoso Projector 720p M620 Black	2490523,02
WWI Laptop15 M0150 Blue	2490872,52
Contoso SLR Camera X143 Silver	2497603,96
Litware Home Theater System 5.1 Channel M513 Black	2499588,65
Contoso Washer & Dryer 25.5in M255 Pink	2505742,20
Fabrikam Refrigerator 24.7CuFt X9800 Grey	2522616,1168
Contoso SLR Camera X142 Black	2525118,96
Adventure Works Laptop15 M1501 White	2535489,69
Contoso SLR Camera X143 Grey	2552720,68
Fabrikam Business Videographer 1/3'' 8.5mm M380 White	2557068,88
Adventure Works Laptop15 M1501 Blue	2562338,28
Litware Microwave 1.5CuFt X110 Grey	2570681,5662
Adventure Works 52" LCD HDTV X790W Brown	2570734,276
WWI Projector 1080p DLP86 White	2577568,56
Adventure Works Laptop15 M1501 Silver	2580057,93
NT Washer & Dryer 25.5in M2550 Blue	2596103,136
Fabrikam Laptop15 M5000 White	2605760,16
Contoso Washer & Dryer 15.5in E155 White	2617010,37
Adventure Works 52" LCD HDTV X790W White	2631826,99
Fabrikam Business Videographer 1/3'' 8.5mm M380 Grey	2641567,40
NT Washer & Dryer 15.5in E1550 Blue	2645725,401
WWI Laptop15 M0150 White	2667335,07
Proseware Projector 720p LCD56 Silver	2672256,03
WWI Projector 720p LCD56 White	2674870,29
A. Datum SLR Camera X135 Black	2685002,10
Fabrikam Business Videographer 1'' 25mm M600 Grey	2686082,30
Contoso Washer & Dryer 15.5in E155 Red	2697319,98
WWI Projector 1080p LCD86 White	2698988,85
WWI Desktop PC3.0 M0300 Silver	2699267,21
WWI Laptop15 M0150 Black	2706108,60
Contoso Washer & Dryer 25.5in M255 White	2706372,63
Fabrikam Business Videographer 2/3" 17mm M280 Blue	2716360,24
Fabrikam Business Videographer 2/3'' 17mm M280 Grey	2718062,00
Fabrikam Trendsetter 1/3'' 8.5mm X200 Black	2718249,03
Contoso Coffee Maker Super-Auto 12C X1250 White	2721988,50
Adventure Works Laptop15 M1500 Black	2722164,63
NT Washer & Dryer 25.5in M2550 White	2722740,372
Fabrikam Laptop15.4 M5400 White	2736280,03
Adventure Works 40" LCD HDTV M690 Brown	2745587,3397
Fabrikam Business Videographer 2/3" 17mm M280 Orange	2747650,50
Fabrikam Business Videographer 1/3" 8.5mm M380 Orange	2750632,60
Contoso Projector 720p M620 White	2754409,50
WWI Desktop PC3.0 M0300 Black	2760021,13
Proseware Laptop15 M510 Black	2776029,57
WWI LCD24 X300 Black	2777302,71
Adventure Works Laptop15.4W M1548 Red	2802879,34
Contoso Water Heater 4.0GPM M1250 Blue	2819195,19
Adventure Works 42" LCD HDTV M55 Black	2831201,9714
Contoso Water Heater 4.0GPM M1250 Green	2832832,03
Fabrikam Business Videographer 2/3'' 17mm M280 White	2849141,34
Contoso Water Heater 4.0GPM M1250 Silver	2856269,36
Adventure Works Laptop15.4W M1548 Silver	2870879,52
NT Washer & Dryer 25.5in M2550 Silver	2873395,701
Contoso Water Heater 4.0GPM M1250 White	2877491,89
WWI LCD24 X300 White	2882388,60
Contoso Washer & Dryer 15.5in E155 Green	2885721,39
NT Washer & Dryer 15.5in E1550 White	2900189,952
Fabrikam Business Videographer 2/3'' 17mm M280 Black	2912601,50
Adventure Works Desktop PC1.80 ED180 Black	2913579,72
Litware Washer & Dryer 15.5in E150 Green	2925101,97
Contoso Water Heater 4.0GPM M1250 Grey	2928519,30
Fabrikam Laptop15.4W M5480 White	2942813,72
NT Washer & Dryer 15.5in E1550 Green	2943735,597
Adventure Works LCD24W X300 Black	2964280,66
Contoso Washer & Dryer 25.5in M255 Green	2968920,63
Adventure Works Laptop15.4W M1548 Black	2981100,30
NT Washer & Dryer 25.5in M2550 Green	2996550,612
Litware Washer & Dryer 25.5in M350 Silver	3007487,34
WWI Laptop15.4W M0156 Black	3028065,98
Contoso Water Heater 4.0GPM M1250 Red	3034244,36
Contoso Washer & Dryer 15.5in E155 Silver	3044612,34
WWI Laptop15.4W M0156 White	3044772,30
Fabrikam Trendsetter 1/2" 3mm X300 Orange	3046310,00
Fabrikam Business Videographer 1" 25mm M600 Blue	3054221,90
Contoso Coffee Maker Super-Auto 12C X1250 Silver	3054529,50
Contoso Washer & Dryer 25.5in M255 Red	3054765,87
Adventure Works Desktop PC1.80 ED180 Silver	3074113,17
Litware Washer & Dryer 15.5in E150 Silver	3078398,52
Fabrikam Business Videographer 1/2'' 3mm M500 Black	3099069,60
Contoso Washer & Dryer 15.5in E155 Blue	3101455,44
Litware Washer & Dryer 25.5in M350 Green	3119189,58
Fabrikam Business Videographer 1/2'' 3mm M500 Grey	3120515,20
Adventure Works Desktop PC1.80 ED180 White	3133049,85
Contoso Washer & Dryer 25.5in M255 Silver	3134047,41
Fabrikam Laptop17 M7000 Black	3150537,39
Litware Washer & Dryer 15.5in E150 Blue	3152983,86
Adventure Works LCD24W X300 White	3156642,50
Fabrikam Business Videographer 1/3'' 8.5mm M380 Black	3186669,80
Contoso Coffee Maker Super-Auto 12C X1250 Grey	3189664,50
Fabrikam Business Videographer 1/2" 3mm M500 Orange	3200885,60
Fabrikam Trendsetter 2/3" 17mm X100 Orange	3208747,36
Litware Washer & Dryer 15.5in E150 White	3220795,98
Litware Washer & Dryer 25.5in M350 White	3236441,13
Contoso Coffee Maker Super-Auto 12C X1250 Black	3241161,00
Adventure Works Desktop PC1.80 ED180 Brown	3257771,85
Fabrikam Business Videographer 1'' 25mm M600 White	3260265,80
Litware Washer & Dryer 25.5in M350 Blue	3285589,32
Fabrikam Business Videographer 1'' 25mm M600 Black	3339146,40
Contoso Washer & Dryer 15.5in E155 Pink	3407868,72
Contoso Projector 720p M621 White	3425201,37
Contoso Home Theater System 7.1 Channel M1700 Silver	3453267,16
Fabrikam Independent Filmmaker 1/3" 8.5mm X200 Blue	3458932,20
Proseware Projector 720p DLP56 Black	3475471,05
NT Washer & Dryer 15.5in E1550 Silver	3491700,795
Contoso Washer & Dryer 25.5in M255 Blue	3498392,43
Contoso Projector 720p M621 Black	3502953,54
Contoso Projector 720p M621 Silver	3532633,83
Contoso Home Theater System 7.1 Channel M1700 Black	3543171,73
Adventure Works Desktop PC3.0 MS300 Black	3546155,90
Fabrikam Laptop16W M6080 Black	3569641,82
Fabrikam Trendsetter 1/2'' 3mm X300 White	3574092,33
Fabrikam Trendsetter 2/3'' 17mm X100 Black	3576745,20
Fabrikam Trendsetter 1/2'' 3mm X300 Grey	3619476,90
SV Keyboard E90 White	3621950,7597
Contoso Home Theater System 7.1 Channel M1700 Brown	3622390,52
Contoso Home Theater System 7.1 Channel M1700 White	3625715,38
SV 40GB USB2.0 Portable Hard Disk E400 Silver	3629145,618
Fabrikam Trendsetter 1'' 25mm X400 White	3651580,00
Fabrikam Trendsetter 1/3'' 8.5mm X200 White	3656023,30
Fabrikam Trendsetter 1" 25mm X400 Blue	3690540,00
WWI Projector 720p DLP56 Black	3701484,81
Fabrikam Trendsetter 1'' 25mm X400 Black	3702561,60
Proseware Projector 720p DLP56 White	3707458,83
Fabrikam Trendsetter 2/3'' 17mm X100 Grey	3710093,80
Fabrikam Trendsetter 1/3'' 8.5mm X200 Grey	3713498,12
Adventure Works Desktop PC1.80 ED182 Black	3773775,094
